{
  "schema_version": "1.0",
  "scope_version": "manual-local-v2",
  "registry_ref": "$COLLAB/harness-mc/system-workflow/registries/morrowise-document-sources.json",
  "reviewed_at": "2026-09-14",
  "source_allowlist": [
    "$COLLAB/harness-mc/docs/morrowise/OPERATOR-GUIDE.md"
  ],
  "public_allowlist": [
    "operator-guide-collaboration",
    "operator-guide-delivery",
    "operator-guide-documentation",
    "operator-guide-entry",
    "operator-guide-execution",
    "operator-guide-troubleshooting"
  ],
  "records": [
    {
      "id": "operator-guide-entry",
      "record_kind": "document",
      "system_id": "morrowise",
      "title": "首次啟動與接手",
      "architecture_layer": "entry",
      "document_role": "human_guide",
      "audience": "both",
      "status": "conditional",
      "visibility": "local_only",
      "source_refs": [
        {
          "path": "$COLLAB/harness-mc/docs/morrowise/OPERATOR-GUIDE.md",
          "relation": "canonical",
          "fingerprint": "7a01f62375e652c5f0e12628fca99ae2cef1e01f3d481990b479ef1d5277f0d4"
        }
      ],
      "member_globs": [],
      "generated_targets": [],
      "owner": "Vincent / JV-36",
      "task_anchor": "morrowise/document-source-registry-and-human-sync",
      "write_policy": "manual",
      "verifiers": [
        "node scripts/verify-morrowise-document-sources.mjs",
        "node scripts/verify-morrowise-docs-surface.mjs",
        "node scripts/verify-morrowise-documentation-impact.mjs",
        "node scripts/verify-morrowise-documentation-sync.mjs"
      ],
      "fingerprint_policy": "full_content",
      "fingerprint_fields": [],
      "summary_impact": "human",
      "architecture_summary": "登入後唯讀判定、必讀來源、當次授權與安全接手；ready 不代表已核准工作。",
      "human_summary": "登入後唯讀判定、必讀來源、當次授權與安全接手；ready 不代表已核准工作。",
      "human_content_ref": "$COLLAB/harness-mc/docs/morrowise/OPERATOR-GUIDE.md",
      "summary_reviewed_source_fingerprint": "7a01f62375e652c5f0e12628fca99ae2cef1e01f3d481990b479ef1d5277f0d4",
      "summary_reviewed_at": "2026-09-27",
      "summary_reviewed_by": "Codex /root/rt15_acceptance_judgment; independent review: Codex /root/live_entry_check",
      "last_verified_at": "2026-09-27",
      "supersedes": [],
      "superseded_by": [],
      "chapter_id": "entry",
      "document_version": "v0.4.1"
    },
    {
      "id": "operator-guide-collaboration",
      "record_kind": "document",
      "system_id": "morrowise",
      "title": "多人協作",
      "architecture_layer": "capabilities",
      "document_role": "human_guide",
      "audience": "both",
      "status": "conditional",
      "visibility": "local_only",
      "source_refs": [
        {
          "path": "$COLLAB/harness-mc/docs/morrowise/OPERATOR-GUIDE.md",
          "relation": "canonical",
          "fingerprint": "7a01f62375e652c5f0e12628fca99ae2cef1e01f3d481990b479ef1d5277f0d4"
        }
      ],
      "member_globs": [],
      "generated_targets": [],
      "owner": "Vincent / JV-36",
      "task_anchor": "morrowise/document-source-registry-and-human-sync",
      "write_policy": "manual",
      "verifiers": [
        "node scripts/verify-morrowise-document-sources.mjs",
        "node scripts/verify-morrowise-docs-surface.mjs",
        "node scripts/verify-morrowise-documentation-impact.mjs",
        "node scripts/verify-morrowise-documentation-sync.mjs"
      ],
      "fingerprint_policy": "full_content",
      "fingerprint_fields": [],
      "summary_impact": "human",
      "architecture_summary": "一人協調、單檔單 writer、四種接手情境與独立驗收；workbook 仍為具名 opt-in。",
      "human_summary": "一人協調、單檔單 writer、四種接手情境與独立驗收；workbook 仍為具名 opt-in。",
      "human_content_ref": "$COLLAB/harness-mc/docs/morrowise/OPERATOR-GUIDE.md",
      "summary_reviewed_source_fingerprint": "7a01f62375e652c5f0e12628fca99ae2cef1e01f3d481990b479ef1d5277f0d4",
      "summary_reviewed_at": "2026-09-27",
      "summary_reviewed_by": "Codex /root/rt15_acceptance_judgment; independent review: Codex /root/live_entry_check",
      "last_verified_at": "2026-09-27",
      "supersedes": [],
      "superseded_by": [],
      "chapter_id": "collaboration",
      "document_version": "v0.5.1"
    },
    {
      "id": "operator-guide-execution",
      "record_kind": "document",
      "system_id": "morrowise",
      "title": "Task 執行與驗收",
      "architecture_layer": "rules",
      "document_role": "human_guide",
      "audience": "both",
      "status": "active",
      "visibility": "local_only",
      "source_refs": [
        {
          "path": "$COLLAB/harness-mc/docs/morrowise/OPERATOR-GUIDE.md",
          "relation": "canonical",
          "fingerprint": "7a01f62375e652c5f0e12628fca99ae2cef1e01f3d481990b479ef1d5277f0d4"
        }
      ],
      "member_globs": [],
      "generated_targets": [],
      "owner": "Vincent / JV-36",
      "task_anchor": "morrowise/document-source-registry-and-human-sync",
      "write_policy": "manual",
      "verifiers": [
        "node scripts/verify-morrowise-document-sources.mjs",
        "node scripts/verify-morrowise-docs-surface.mjs",
        "node scripts/verify-morrowise-documentation-impact.mjs",
        "node scripts/verify-morrowise-documentation-sync.mjs"
      ],
      "fingerprint_policy": "full_content",
      "fingerprint_fields": [],
      "summary_impact": "human",
      "architecture_summary": "從原需求到實作、驗收、no_change／blocked 及正式證據回寫；不另建追蹤器。",
      "human_summary": "從原需求到實作、驗收、no_change／blocked 及正式證據回寫；不另建追蹤器。",
      "human_content_ref": "$COLLAB/harness-mc/docs/morrowise/OPERATOR-GUIDE.md",
      "summary_reviewed_source_fingerprint": "7a01f62375e652c5f0e12628fca99ae2cef1e01f3d481990b479ef1d5277f0d4",
      "summary_reviewed_at": "2026-09-27",
      "summary_reviewed_by": "Codex /root/rt15_acceptance_judgment; independent review: Codex /root/live_entry_check",
      "last_verified_at": "2026-09-27",
      "supersedes": [],
      "superseded_by": [],
      "chapter_id": "execution",
      "document_version": "v0.4.0"
    },
    {
      "id": "operator-guide-delivery",
      "record_kind": "document",
      "system_id": "morrowise",
      "title": "版本交付與接續",
      "architecture_layer": "governance",
      "document_role": "human_guide",
      "audience": "both",
      "status": "active",
      "visibility": "local_only",
      "source_refs": [
        {
          "path": "$COLLAB/harness-mc/docs/morrowise/OPERATOR-GUIDE.md",
          "relation": "canonical",
          "fingerprint": "7a01f62375e652c5f0e12628fca99ae2cef1e01f3d481990b479ef1d5277f0d4"
        }
      ],
      "member_globs": [],
      "generated_targets": [],
      "owner": "Vincent / JV-36",
      "task_anchor": "morrowise/document-source-registry-and-human-sync",
      "write_policy": "manual",
      "verifiers": [
        "node scripts/verify-morrowise-document-sources.mjs",
        "node scripts/verify-morrowise-docs-surface.mjs",
        "node scripts/verify-morrowise-documentation-impact.mjs",
        "node scripts/verify-morrowise-documentation-sync.mjs"
      ],
      "fingerprint_policy": "full_content",
      "fingerprint_fields": [],
      "summary_impact": "human",
      "architecture_summary": "本機 commit 與遠端交付分開驗證；CI／正式 Review 與發布追蹤沿單一交付入口。",
      "human_summary": "本機 commit 與遠端交付分開驗證；CI／正式 Review 與發布追蹤沿單一交付入口。",
      "human_content_ref": "$COLLAB/harness-mc/docs/morrowise/OPERATOR-GUIDE.md",
      "summary_reviewed_source_fingerprint": "7a01f62375e652c5f0e12628fca99ae2cef1e01f3d481990b479ef1d5277f0d4",
      "summary_reviewed_at": "2026-09-27",
      "summary_reviewed_by": "Codex /root/rt15_acceptance_judgment; independent review: Codex /root/live_entry_check",
      "last_verified_at": "2026-09-27",
      "supersedes": [],
      "superseded_by": [],
      "chapter_id": "delivery",
      "document_version": "v0.6.3"
    },
    {
      "id": "operator-guide-documentation",
      "record_kind": "document",
      "system_id": "morrowise",
      "title": "文件更新與同步",
      "architecture_layer": "governance",
      "document_role": "human_guide",
      "audience": "both",
      "status": "active",
      "visibility": "local_only",
      "source_refs": [
        {
          "path": "$COLLAB/harness-mc/docs/morrowise/OPERATOR-GUIDE.md",
          "relation": "canonical",
          "fingerprint": "7a01f62375e652c5f0e12628fca99ae2cef1e01f3d481990b479ef1d5277f0d4"
        }
      ],
      "member_globs": [],
      "generated_targets": [],
      "owner": "Vincent / JV-36",
      "task_anchor": "morrowise/document-source-registry-and-human-sync",
      "write_policy": "manual",
      "verifiers": [
        "node scripts/verify-morrowise-document-sources.mjs",
        "node scripts/verify-morrowise-docs-surface.mjs",
        "node scripts/verify-morrowise-documentation-impact.mjs",
        "node scripts/verify-morrowise-documentation-sync.mjs"
      ],
      "fingerprint_policy": "full_content",
      "fingerprint_fields": [],
      "summary_impact": "human",
      "architecture_summary": "能力變更先做文件影響審查，再生成單一來源的已審查正文、導航與搜尋。",
      "human_summary": "能力變更先做文件影響審查，再生成單一來源的已審查正文、導航與搜尋。",
      "human_content_ref": "$COLLAB/harness-mc/docs/morrowise/OPERATOR-GUIDE.md",
      "summary_reviewed_source_fingerprint": "7a01f62375e652c5f0e12628fca99ae2cef1e01f3d481990b479ef1d5277f0d4",
      "summary_reviewed_at": "2026-09-27",
      "summary_reviewed_by": "Codex /root/rt15_acceptance_judgment; independent review: Codex /root/live_entry_check",
      "last_verified_at": "2026-09-27",
      "supersedes": [],
      "superseded_by": [],
      "chapter_id": "documentation",
      "document_version": "v0.5.2"
    },
    {
      "id": "operator-guide-troubleshooting",
      "record_kind": "document",
      "system_id": "morrowise",
      "title": "故障處理與交接",
      "architecture_layer": "runtime",
      "document_role": "human_guide",
      "audience": "both",
      "status": "active",
      "visibility": "local_only",
      "source_refs": [
        {
          "path": "$COLLAB/harness-mc/docs/morrowise/OPERATOR-GUIDE.md",